<?xml version="1.0" encoding="UTF-8"?>
<!DOCTYPE report SYSTEM "dtd/csv.dtd" >
<report>
  <filename>测试报表</filename>
  <sources>
  	<source name="test">
  		<sql value="
  		SELECT r.*, s.dname as idpname, agent.id as agentid, agent.dname as agentname, 
  		supp.dname AS suppliername
		from dcontractbuy r 
		left join (select id, dname from dcontractsale) s
		on s.id = r.idp
        left join (select id, dname from dagent) agent
		on agent.id = r.dagent
        LEFT JOIN (SELECT id, dname FROM dsupplier) supp ON supp.id = r.idsupplier
		WHERE 1=1
		ORDER BY r.idx desc
  		">
  			<fields>
  				<field name="idpname"/>
  				<field name="agentid"/>
  				<field name="agentname"/>
  				<field name="suppliername"/>
  			</fields>
  		</sql>
  	</source>
  </sources>
  <page>
    <table>
      <tr>
      	<td>adfas
      	</td>
      	<td>adfas
      	</td>
      </tr>
      <tr>
      	<td>adfas
      	</td>
      	<td>adfas
      	</td>
      </tr>
      <tr>
        <td>
        	<table>
		     	<tr source="test">
			        <td field="idpname"/>
			        <td field="agentid"/>
			        <td field="agentname"/>
			        <td field="suppliername"/>
	       		</tr>
        	</table>
        </td>
        <td>
        	<table>
        		<tr>
        			<td>sadfasf</td>
        			<td>sadfasf</td>
        			<td>sadfasf</td>
        			<td>sadfasf</td>
        			<td>sadfasf</td>
        		</tr>
        	</table>
        </td>
      </tr>
    </table>
    
    <table>
    	<tr>
    		<td>aaaaaaaaaaaaaaa</td>
    	</tr>
    </table>
  </page>
</report>
